{
  "schemaVersion": 1,
  "project": "Off the Rails — 24-second proof",
  "asOf": "2026-07-18",
  "sources": [
    {
      "id": "fra-freight-rail-overview",
      "title": "Freight Rail Overview",
      "publisher": "Federal Railroad Administration",
      "url": "https://railroads.dot.gov/rail-network-development/freight-rail-overview",
      "accessedAt": "2026-07-18"
    },
    {
      "id": "aar-freight-rail-facts",
      "title": "Freight Rail Facts & Figures",
      "publisher": "Association of American Railroads",
      "url": "https://www.aar.org/facts-figures",
      "accessedAt": "2026-07-18",
      "notes": "Industry source; corroborate numerical claims with public data before publication."
    }
  ],
  "claims": [
    {
      "id": "network-scale",
      "text": "The U.S. freight rail network spans roughly 140,000 route miles.",
      "status": "verified",
      "sourceIds": ["fra-freight-rail-overview"]
    },
    {
      "id": "freight-specialization",
      "text": "The U.S. rail system is heavily specialized for freight movement over long distances.",
      "status": "draft",
      "sourceIds": ["fra-freight-rail-overview", "aar-freight-rail-facts"],
      "notes": "Rewrite and independently verify the Europe comparison before publication."
    }
  ]
}
